{
  "id": "acfs:record:example:capability:release-checklist",
  "kind": "capability",
  "status": "draft",
  "scope": "workspace:example",
  "title": "Release checklist",
  "body": "Check that required tests, documentation updates, and package artifacts are present before publishing a release.",
  "metadata": {
    "acfs_version": "v0.2.1",
    "artifact_type": "script",
    "artifact_ref": "scripts/release_checklist.sh",
    "runtime_constraints": "approval-required",
    "extensions": [
      "example.procedure.v1"
    ],
    "required_extensions": [
      "example.procedure.v1"
    ],
    "example.procedure.v1": {
      "kind": "procedure",
      "relations": [
        {
          "type": "reviewed_by",
          "target": "user:reviewer"
        }
      ]
    }
  },
  "provenance": {
    "actor": "codex",
    "created_at": "2026-08-15T00:00:00Z",
    "source": "repeated release validation workflow"
  }
}
