{
  "id": "acfs:record:example:memory:old-release-branch-guidance",
  "kind": "memory",
  "status": "revoked",
  "scope": "workspace:example",
  "title": "Old release branch guidance",
  "body": "This record is retained only for audit. It must not guide future release branch selection.",
  "provenance": {
    "actor": "codex",
    "created_at": "2026-08-15T00:00:00Z",
    "source": "revocation example"
  },
  "metadata": {
    "acfs_version": "v0.2.1"
  }
}
